img_filename,ref_text
sample1.JPG,ọwọ́ ọmọ́de o to pẹpẹti àgbàlagbà o wọ.kẹ̀rẹ̀gbẹ̀pàsan ti afi na ìyaleoun bẹ lọ́ri àjà ti afi naa ìyàwo.
sample2.JPG,òkò ìrẹ̀se ọmọ wòyiràwòyirà ko ma ba ra ẹ́rukẹruabi lala lẹnubi ònirèse o ba fin ígba maaèyi to ti fin òni gbẹ
sample3.JPG,ómó lare bure íkan o gbọ dọ ju íkan bi íkan ba ju íkan ni íle ọ̀lọọfá mọ jọ ọba ni ko won póró ìjà kadi lórò ọ̀ffà ànàmọ ni ounjẹ òffà
sample4.JPG,ìjà kumọ́ kan o kin rin ìrìn lọsan ẹni abire o kin rin loru. álagẹ́mọ̀ ti bi ọ́mọ́ rẹ na aimójo ku si ọ́mọ́ lọwọ
sample5.JPG,"ája ti o ba sọ́nù oni gbọ fèrè ọ̀lọdẹ̀ojumọ ire lomọ mi loniònà ṣhi ọ̀nà la, ire lóju ówo ri, óri mi oni kọ íré íré óju ówo ri"
sample6.JPG,"ája ti o ba sọ́nù oni gbọ fèrè ọ̀lọdẹ̀ojumọ ire lomọ mi loniònà ṣhi ọ̀nà la, ire lóju ówo ri, óri mi oni kọ íré íré óju ówo ri"
